category,pub_date,url,keywords,authors,id,collection_name,title,is_processed
corporate_governance,2024-08-23,https://doi.org/10.1007/s11256-024-00710-y,"{Medellín,Colombia,Bilingualism,""English language education"",Neoliberalism,""Economic development"",""Social inclusion"",Marginalization,""Language policy"",Globalization,""Fourth Industrial Revolution (4IR)"",Technology,""Urban development"",Innovation,Competitiveness,""Socioeconomic disparity"",""Public education"",""Private education"",""Standardized tests (Saber 11)"",""Language proficiency"",""Intercultural approach"",""Language planning"",Multilingualism,""Aburrá Valley"",""Software Valley"",""Foreign language use"",""Workforce development"",""Educational equity"",""Social mobility"",""Language as a commodity"",""Peace Agreements"",""Drug cartel violence"",Tourism,""Foreign Direct Investment (FDI)"",""Industry 4.0"",""Digital economy"",""Teacher training"",""Qualitative research"",""Document analysis"",Surveys,Interviews,""Triangulation of data"",""Common European Framework of Reference for Languages (CEFR)"",""This list combines high-level themes with more specific terms and concepts discussed in the text.  It aims to be comprehensive while also highlighting the core focus of the research.""}","Paula Andrea Echeverri Sucerquia, Cristian Andrés Medina Rúa",307,corporate_governance,"Neoliberal Agendas in English Language Education in Urban Latin America: The Case of Medellín, Colombia",True
corporate_governance,2025-02-17,https://doi.org/10.1186/s40309-025-00248-6,"{""Anticipatory Macroeconomic Governance:** This is the central theme of the paper."",""Economic Resilience:**  A key objective of anticipatory governance."",""Sustainability:** Another core objective, particularly in the context of long-term economic planning."",""Uncertainty:** A defining characteristic of the modern economic environment, necessitating anticipatory approaches."",""Foresight:**  A key method within anticipatory practices, encompassing scenario planning, horizon scanning, etc."",""Forecasting:**  Traditional economic prediction methods, contrasted with foresight."",""Innovation:** How anticipatory practices interact with and promote innovation."",""Policy Formulation:** How anticipatory thinking influences policy creation."",""Institutional Context:** The role of institutions (e.g., central banks) in shaping anticipatory practices."",""Cultural Factors:** How cultural values and beliefs influence the adoption and effectiveness of anticipatory practices."",""National Context:**  The influence of national circumstances (e.g., resource dependence) on anticipatory approaches."",""Interconnections (Micro, Meso, Macro):** How anticipatory practices operate across different levels of the economic system."",""Performativity:** The idea that anticipatory practices not only predict but also shape economic outcomes."",""Institutionalization:** The process of embedding anticipatory practices within formal structures and organizational cultures."",""Temporal Dynamics:** How anticipatory practices evolve over time, influenced by crises and paradigm shifts."",""Cultures of Anticipation:** Shared beliefs and practices that shape how economic actors engage with the future (e.g., technocratic, political-economic, adaptive)."",""(In)visible Voices:**  Whose perspectives are included or excluded in anticipatory processes."",""Stakeholder Engagement:**  The importance of involving diverse stakeholders in anticipatory planning."",""Climate Change:** A key challenge requiring anticipatory approaches."",""Technological Disruption:** Another major driver of uncertainty and the need for foresight."",""Global Interconnectedness:** The increasing complexity of the global economy and its implications for anticipatory governance."",""Adaptive Governance:**  Flexible and responsive governance frameworks that can adapt to changing circumstances."",""Responsible Research and Innovation (RRI):**  A framework emphasizing anticipation, reflexivity, and inclusion in innovation processes."",""Multi-Level Perspective (MLP):** A framework for understanding how innovations emerge and scale up in socio-technical systems."",""This list covers the most prominent keywords.  Some more specific terms (e.g., \""yield curve control,\"" \""dynamic stochastic general equilibrium models\"") are important within particular sections of the text but might not be considered overarching keywords for the entire paper.""}",Ceyhun Elgin,308,corporate_governance,Anticipatory macroeconomic governance: exploring future-oriented strategies for economic resilience and sustainability,True
corporate_governance,2024-11-07,https://doi.org/10.1007/s12662-024-00985-z,"{""Sustainability Transition:** This is the overarching theme of the text, focusing on how sport organizations are adapting to and implementing sustainable practices."",""Sustainable Development Goals (SDGs):**  The specific framework used by the organizations in the study to guide their sustainability efforts.  This is a central concept."",""Sport Organizations:** The primary unit of analysis, including national governing bodies (NGBs), national sport federations (NFs), regional sport federations (RSFs), and local sport clubs."",""Norwegian Sport:** The specific context of the study."",""Strategy:** How sport organizations are incorporating sustainability into their strategic planning and decision-making."",""Prioritization:** How sport organizations are selecting and ranking the SDGs based on relevance and feasibility."",""Institutional Theory:** The theoretical lens used to analyze the influence of external pressures on organizational behavior.  Specifically, coercive, normative, and mimetic pressures."",""Green Waves Framework:** The framework used to understand the stages of sustainability implementation in sport organizations."",""Legitimacy:** The concept of organizations conforming to societal expectations and norms to ensure survival."",""Decoupling:** The gap between stated intentions and actual practices regarding sustainability."",""Challenges/Barriers:** Obstacles faced by sport organizations in implementing sustainability, such as competing agendas, lack of knowledge, resistance to change, and lack of resources."",""Stakeholder Expectations:** The demands and pressures from various stakeholders (e.g., sponsors, government, public) related to sustainability."",""Policy:**  The role of policy documents and guidelines in promoting and implementing sustainability in sport."",""Implementation:** The practical aspects of putting sustainability strategies into action."",""Measurement/Assessment:**  Tracking and evaluating the progress of sustainability initiatives."",""Education:** The role of education in raising awareness and promoting sustainable practices."",""Corporate Social Responsibility (CSR):**  The connection between sustainability and broader CSR efforts."",""Environmental Sustainability:** A key dimension of sustainability, particularly relevant to outdoor sports."",""Social Inclusion/Equality:**  Focus on reducing inequalities and promoting gender equality within sport."",""Climate Action:**  Addressing the impact of sport on climate change and mitigating its effects."",""Responsible Consumption and Production:**  Focus on resource use, waste management, and sustainable procurement."",""Partnerships:** The importance of collaboration and partnerships in achieving sustainability goals."",""It\\""}","Anna-Maria Strittmatter, Chris Horbel, Josephine Traberg, Julius Z. Strömberg, Annika Bodemar, Allan B. Grønkjær, Dag Vidar Hanstad",309,corporate_governance,Prioritization of the Sustainable Development Goals in the sustainability transition process of sport organizations: national strategies and sport managers’ perspectives,True
Cancer,2024-12-18,https://doi.org/10.1038/s41388-024-03264-1,"{""Breast Cancer Stem Cells (BCSCs)"",""Tumor-initiating cells"",Chemoresistance,Radioresistance,""DNA Damage Repair"",""Double Strand Breaks (DSBs)"",""Homologous Recombination (HR)"",""Interstrand Crosslinks (ICLs)"",Cisplatin,Radiotherapy,""PRMT5 (Protein arginine methyltransferase 5)"",""GSK3203591 (PRMT5 inhibitor)"",""RNA splicing"",""Differential Splicing Events (DSEs)"",""Skipped Exons (SE)"",""Retained Introns (RI)"",""Gene Ontology (GO)"",""DNA Repair Pathways (HR, FA, TLS, NHEJ, BER)"",""Replication Stress (RS)"",""Fanconi Anemia (FA)"",53BP1,FANCD2,RPA,RAD51,EXO1,CHD1L,RAD17,RAD51D,ATM,SLX4,DDX11,PNKP,FAN1,SRSF1,""Differential Gene Expression (DEGs)"",""Nonsense-Mediated Decay (NMD)"",""Detained Introns (DI)"",""MCF7 cell line"",""AU565 cell line"",""Mammosphere assay"",""Anoikis resistance"",""Flow cytometry (ESA+CD24low/CD44+)"",""Patient-derived xenografts (PDXs)""}","Matthew S. Gillespie, Kelly Chiang, Gemma L. Regan-Mochrie, Soo-Youn Choi, Ciara M. Ward, Debashish Sahay, Paloma Garcia, Roland Arnold, Clare C. Davies",347,Cancer,PRMT5-regulated splicing of DNA repair genes drives chemoresistance in breast cancer stem cells,True
corporate_governance,2024-06-05,https://doi.org/10.1007/s11846-024-00779-5,"{""\""* **Sustainable Agriculture/Viticulture/Winemaking:** This is the overarching theme."",""Sustainable Development:**  A core concept linked to the broader societal and environmental goals."",""Circular Economy:** The economic model emphasizing resource efficiency and waste minimization."",""Industrial Symbiosis:** Collaboration between industries to utilize waste as resources."",""Waste Valorisation:**  The process of adding value to waste products."",""Wine Waste/By-products:** Grape pomace, skins, seeds, stems, lees, wastewater."",""Bioenergy/Biogas/Biorefinery:**  Methods for converting wine waste into energy."",""Bioactive Compounds:** Valuable substances extracted from wine waste (e.g., polyphenols, antioxidants)."",""Compost/Fertilizer:** Using wine waste to enrich soil."",""Value-Added Products:** Creating new products from wine waste (e.g., food additives, cosmetics, packaging, textiles)."",""Sustainable Business Models:** Strategies for integrating sustainability into wine production."",""Technological Innovations:** New technologies for waste processing and sustainable winemaking."",""Performance Measurement/Indicators:** Metrics for assessing sustainability performance (e.g., water use, energy consumption, GHG emissions)."",""Drivers and Barriers:** Factors influencing the adoption of sustainable practices."",""Supply Chain Management:** Integrating sustainability throughout the wine supply chain."",""Stakeholder Engagement:**  Collaboration between winemakers, researchers, policymakers, and consumers."",""Economic Benefits:** Cost savings, new revenue streams, increased competitiveness."",""Environmental Benefits:** Waste reduction, pollution mitigation, resource conservation."",""Social Benefits:** Community engagement, improved brand reputation."",""Life Cycle Assessment (LCA):** A method for evaluating environmental impact."",""Multi-Criteria Decision Making (MCDM):** A framework for evaluating trade-offs between different criteria."",It}","Stefano Abbate, Piera Centobelli, Maria Di Gregorio",310,corporate_governance,Wine waste valorisation: crushing the research domain,True
marketing,2025-06-01,https://api.elsevier.com/content/abstract/scopus_id/85216763401,"{""Digital Business**"",""Film Marketing** (or Movie Marketing)"",""Social Media Marketing**"",""Chinese Film Market** (or Chinese Movie Market)"",""Box Office Revenue**"",Hollywood**,""eWOM** (Electronic Word of Mouth)"",""Broadcast Marketing**"",""Sequential Marketing**"",Maoyan**,Douban**,""Volume** (in the context of social media engagement)"",""Valence** (in the context of social media sentiment)"",""Feature Importance**"",""Random Forest (RF)**"",""Polynomial Regression**"",""High-Budget Movies**"",""Low-Budget Movies**"",""Movie Release Cycle**"",""Opening Weekend Revenue**"",""Walled Garden Ecosystem** (in the context of Chinese internet)"",""Key Opinion Leaders (KOLs)**"",""Some additional, more specific keywords that might be relevant depending on the context:"",Weibo**,TikTok**,""Film Distribution**"",""Consumer Engagement**"",""Predictive Modeling**"",""Social Media Platforms** (specifically in China)"",""Chinese Moviegoers**"",""Quota System** (for foreign films in China)"",""This list prioritizes the most prominent and recurring concepts in the text.  The less specific terms like \""Social Media Platforms\"" are included because they provide a broader context for the more specific platforms mentioned.""}",Chou Y.,311,marketing,Sequential film marketing in China: The study of social platforms and their impacts,True
marketing,2025-06-01,https://api.elsevier.com/content/abstract/scopus_id/85216071031,"{""\""* **Workations:** This is the central topic of the paper."",""New Work:** The overarching paradigm shift in work culture."",""Self-Determination Theory (SDT):**  The psychological theory used to understand workation motivation."",""Tourism Innovation:** How tourism adapts to the changing work landscape."",""Destination Marketing/Management:** Strategies to attract workationers."",""Hospitality Industry:**  How hotels and other providers are adapting."",""Guest Expectations:** The changing needs of travelers who work remotely."",""Remote Work:** The broader trend enabling workations."",""Digital Nomadism:**  A related concept, contrasted with workations."",""Bleisure Travel:** Another related concept, also contrasted with workations."",""Work-Life Integration/Balance:** A key driver for workations."",""Motivation:**  Specifically, the motivations behind workation choices."",""COVID-19 Pandemic:** The catalyst for the rise of remote work and workations."",""Technology Dependence:** The role of technology in enabling remote work and workations."",""Accommodation Preferences:** How workationers""}",Wilkesmann M.,312,marketing,From leisure to labor: How workations are reshaping hospitality and destination marketing in the era of New Work,True
marketing,2025-06-01,https://api.elsevier.com/content/abstract/scopus_id/85214196828,"{""Climate Change Perception:**  This is the central theme, focusing on how B2B markets understand and view climate change."",""Marketing Communication:** The study explores how marketing communication influences climate change perception."",""B2B Markets:** The specific target of the marketing communication and the subject of the perception analysis."",""Enviropreneurial Marketing Strategy (EMS):** A marketing approach emphasizing sustainability and environmental responsibility."",""Strategic Schemas (SS):** Cognitive frameworks used by businesses to process information and make decisions related to climate change."",""Advertising Effectiveness:** How effectively advertisements convey climate change and sustainability messages."",""Perceived Credibility of Communication:** The trustworthiness and reliability of climate change information received by businesses."",""Climate Risk Information:** Data about the potential impacts of climate change on business operations."",""Sustainable Development:**  The broader context of the research, linking climate change action with business practices."",""Stimuli-Organism-Response (S-O-R) Theory:** The theoretical framework used to understand the relationship between marketing communication and climate change perception."",""Supply Chain Management:**  How sustainable practices within supply chains can influence climate change perception."",""Collaboration:**  Joint efforts between businesses to address climate change."",""Customer Demand:** The role of environmentally conscious customers in driving sustainable practices."",""Social Responsibility:**  The ethical and societal obligations of businesses to address climate change."",""Government Regulations:** Policies and regulations aimed at reducing greenhouse gas emissions."",""Additionally, some keywords related to the methodology and analysis could be included:"",""Structural Equation Modeling (SEM)**"",""Confirmatory Factor Analysis (CFA)**"",""Quantitative Research**"",""Finally, considering the context, these broader terms might also be relevant:"",""Environmental Marketing**"",""Sustainability Strategies**"",""Business-to-Business (B2B) Communication**"",""Cognitive Processes**"",""Behavioral Responses**""}",Shaik A.S.,313,marketing,Moving markets towards climate change for sustainable development: Comprehending strategic insights for efficient marketing communication,True
marketing,2025-06-01,https://api.elsevier.com/content/abstract/scopus_id/85212051430,"{""\""* **Generative AI (GAI)**: This is the central topic of the paper."",""Digital Marketing (DM)**: The specific field of application for GAI."",""Customer Experience (CE/CX)**: A key outcome of using GAI in DM."",""Behavioral Reasoning Theory (BRT)**: The theoretical framework used to analyze GAI adoption."",""Adoption**: The process of integrating GAI into DM practices."",""Drivers**: Factors motivating the use of GAI."",""Barriers**: Obstacles hindering GAI adoption."",""Innovation**: A perceived benefit and driver of GAI use."",""Creative Communication**: Enhanced by GAI tools."",""Content Creation**: Streamlined and improved by GAI."",""Speed and Efficiency**: Benefits of automation through GAI."",""Personalization/Customization**: Key advantages of GAI in DM."",""Predictive Analytics**: GAI""}",Joshi S.,314,marketing,Harnessing the potential of generative AI in digital marketing using the Behavioral Reasoning Theory approach,True
Cancer,2025-03-03,https://doi.org/10.1038/s41388-025-03319-x,"{""This text primarily discusses copyright and licensing, not the scientific content of the original article.  Therefore, the relevant keywords are:"",""Open Access**"",Copyright**,""Creative Commons Attribution 4.0 International License**"",Licensing**,""CAUL (Council of Australian University Librarians)**"",""Springer Nature**"",""While the original article title is mentioned, extracting keywords from it within this context is misleading.  The correction notice doesn\\""}","Prahlad V. Raninga, Bijun Zeng, Davide Moi, Ethan Trethowan, Federica Saletta, Pooja Venkat, Chelsea Mayoh, Rochelle C. J. D’Souza, Bryan W. Day, Tyler Shai-Hee, Orazio Vittorio, Roberta Mazzieri, Riccardo Dolcetti, Kum Kum Khanna",348,Cancer,Correction: CBL0137 and NKG2A blockade: a novel immuno-oncology combination therapy for Myc-overexpressing triple-negative breast cancers,True
business_management,2025-07-01,https://api.elsevier.com/content/abstract/scopus_id/85214509556,"{""Work-Integrated Learning (WIL)**: This is the central theme of the text."",""Business and Management (BM):** The specific academic discipline under investigation."",""Graduate Employability:** A key outcome of WIL explored in the study."",""Graduate Employment Outcomes:**  Another key outcome of WIL, including job attainment, full-time employment, and occupational status."",""Internship:** A specific type of work-based WIL."",""Practicum:** Another type of work-based WIL."",""Cooperative Education:** A structured approach to WIL."",""Client-based Projects:** A form of non-workplace WIL."",""Consultancy:** A form of non-workplace WIL."",""Simulations:** A learning activity used in WIL."",""Global WIL:** WIL activities with an international component."",""Equity and Inclusion:**  Focus on access and participation for diverse student groups (low SES, disability, international students, regional/remote students)."",""Pedagogical Approach:**  WIL as a teaching and learning strategy."",""Capability Development:**  Skills and competencies gained through WIL."",""Network Development:** Building professional connections through WIL."",""Professional Identity Formation:** Developing a sense of belonging and purpose in a chosen profession through WIL."",""Career Planning and Decision-Making:** WIL\\""}",Jackson D.,325,business_management,Work-Integrated learning in Business and Management: Gauging impact and opportunities for growth,True
business_management,2025-03-01,https://api.elsevier.com/content/abstract/scopus_id/85214929463,"{""Business Model Innovation (BMI)"",""Top Management Team (TMT)"",""TMT Diversity"",""Environmental Turbulence"",""Financial Performance"",Uncertainty,Urgency,""Architectural BMI"",""Modular BMI"",Innovation,""Organizational Change"",""Strategic Renewal"",""Weak Signals"",""Strong Signals"",""Performance Feedback"",""Problemistic Search"",""Slack Search"",""Upper Echelons Theory"",""Value Creation"",""Value Delivery"",""Value Capture"",""Competitive Dynamics"",Norway,""It would also be appropriate to include specific aspects of diversity mentioned, although they are subsumed under the broader \""TMT Diversity\"" keyword:"",""Gender Diversity"",""Ethnicity/Immigration History"",""Educational Diversity"",""Functional Specialization Diversity""}",Angelshaug M.S.,326,business_management,Uncertainty versus urgency: When top management team diversity hinders business model innovation,True
business_management,2025-03-01,https://api.elsevier.com/content/abstract/scopus_id/85213228724,"{""\""* **Business Intelligence (BI)**"",""Data Analytics**"",""Academic Analytics**"",""Learning Analytics**"",""Educational Data Mining (EDM)**"",""Higher Education Institutions (HEIs)**"",""Academic Management**"",""Predictive Analytics**"",""Machine Learning**"",""Data Mining**"",""Data Visualization**"",Bibliometrics**,""Digital Transformation**"",""Student Performance**"",""Student Retention**"",""Student Engagement**"",""Dropout Prediction**"",""Personalized Learning**"",""Online Learning**"",""Distance Education**"",""Blended Learning**"",""Virtual Learning Environments (VLEs)**"",""Learning Management Systems (LMSs)**"",""Big Data**"",""Artificial Intelligence (AI)**"",""Data Science**"",""Ethical Considerations**"",Privacy**,Equity**,""Bias Mitigation**"",""Governance Frameworks**"",Interoperability**,""Systematic Reviews**"",""Quantitative Research**"",""Qualitative Research**"",""Mixed Methods Research**"",""Experimental Research**"",""Case Studies**"",Surveys**,""Bibliometric Analysis**"",""Co-authorship Networks**"",""Geographic Trends**"",""Global Adoption**"",""This list encompasses the core concepts and methodologies discussed in the text, providing a comprehensive representation of the key areas of focus within the research.  It""}",Correa-Peralta M.,327,business_management,"Evolution, topics and relevant research methodologies in business intelligence and data analysis in the academic management of higher education institutions. A literature review",True
business_management,2025-02-01,https://api.elsevier.com/content/abstract/scopus_id/85210303248,"{""Qualitative Comparative Analysis (QCA)**: This is the central method discussed throughout the text.  Subtypes like fuzzy-set QCA (fsQCA), crisp-set QCA (csQCA), multi-value QCA (mvQCA), and two-step QCA are also important."",""Configurational Theory:** The theoretical framework underpinning QCA, including concepts like conjunction, equifinality, and asymmetry.  The distinction between \""traditional\"" and \""neo-configurational\"" approaches is also relevant."",""Business and Management Research:** The specific field of application for QCA explored in the text."",""Hypothesis Testing:**  The text explicitly discusses the *incompatibility* of QCA with traditional hypothesis testing."",""Deductive Research:**  One of the research approaches discussed in relation to QCA, focusing on theory evaluation."",""Inductive Research:** Another research approach discussed, focusing on theory development."",""Mixed Methods:** The integration of QCA with other research methods, such as Structural Equation Modeling (SEM) and Partial Least Squares (PLS)."",""Case Study:** A qualitative method often used in conjunction with QCA."",""Dataset Size:**  The text explores the use of QCA with both small-N and large-N datasets."",""Causal Complexity:** The idea that outcomes result from multiple interacting factors."",""Causal Recipes:** Specific combinations of conditions leading to an outcome."",""Global Innovation Index (GII):** The example used to illustrate the application of QCA."",""Innovation Inputs/Outputs:**  Specific elements within the GII example, such as Institutions, Human Capital & Research, Infrastructure, Market Sophistication, Business Sophistication, Knowledge & Technology Outputs, and Creative Outputs."",""Combinatorial Logic:**  How elements within a configuration interact."",""Factorial Logic:** Which elements are important for an outcome."",""Robustness Tests:** Methods for evaluating the reliability of QCA results."",""Calibration:** The process of converting data into set memberships for QCA."",""Necessity/Sufficiency:**  Tests used in QCA to identify necessary and sufficient conditions for an outcome."",""Counterfactual Analysis:** A key component of QCA, exploring what might have happened under different conditions."",""This list provides a comprehensive overview of the key terms and concepts present in the text.  It captures the methodological focus, the theoretical underpinnings, and the specific context of application.""}",Di Paola N.,328,business_management,Configurational theory in business and management research: Status quo and guidelines for the application of qualitative comparative analysis (QCA),True
