category,pub_date,url,keywords,authors,id,collection_name,title,is_processed
quantum_physics,2024-12-19,http://arxiv.org/abs/2412.15207v1,"{""Quantum diffusion"",Delocalization,""Band matrices"",""Flow method"",""Random matrix universality"",""Gaussian unitary ensemble (GUE)"",""Anderson model"",Localization,""Bethe lattice"",Eigenvalues,Eigenvectors,""Poisson point process"",""Wigner semicircle law"",""Thouless conductance fluctuation theory"",""GUE statistics"",Bulk,""Spectral edge""}","Sofiia Dubova, Kevin Yang",139,quantum_physics,Quantum diffusion and delocalization in one-dimensional band matrices via the flow method,True
quantum_physics,2024-12-19,http://arxiv.org/abs/2412.15196v1,"{""Quantum Otto Engine"",""Control Noise"",""Quantum Enhancement"",""Counterdiabatic Driving"",""Quantum Lubrication"",""Finite-Time Thermodynamics"",""Projective Energy Measurements"",""Thermodynamic Uncertainty Relations"",""Quantum Thermodynamics"",""Open Quantum Systems"",""Noisy Driving Protocols"",""Thermal Baths"",""Quantum Coherence"",""Work Extraction"",Efficiency,Power,Fluctuations,Adiabaticity,""Quantum Control""}","Theodore McKeever, Owen Diba, Ahsan Nazir",140,quantum_physics,A Finite-Time Quantum Otto Engine subject to Control Noise and Enhancement Techniques,True
quantum_physics,2011-06-09,http://dx.doi.org/10.1038/ncomms1544,"{""Quantum Interface"",""Wavelength Conversion"",Visible-to-Telecommunication,""Nonlinear Crystal"",""Wide Bandwidth"",""High-Speed Interface"",""Entanglement Preservation"",""Quantum Communication"",""Quantum Information Processing"",""Optical Fiber Communication"",""Frequency Conversion"",""Second-Order Nonlinearity"",""Periodically-Poled LiNbO3 (PPLN)"",""Difference-Frequency Generation (DFG)"",""Non-Classical Light"",""Single-Photon Pulse"",""Pico-second Pulse"",""Sub-Poissonian Statistics"",""Entangled Photon Pair"",""Quantum Dynamics"",""780 nm"",""1522 nm""}","Rikizo Ikuta, Yoshiaki Kusaka, Tsuyoshi Kitano, Hiroshi Kato, Takashi Yamamoto, Masato Koashi, Nobuyuki Imoto",141,quantum_physics,Wide-band quantum interface for visible-to-telecommunication wavelength conversion,True
quantum_physics,2016-09-30,http://dx.doi.org/10.1038/s41467-017-01905-6,"{""\""* **Quantum Computing:** This is the overarching theme of the text."",""Quantum Error Correction (QEC):**  Specifically mentioned as crucial for large-scale quantum computing."",""Surface Code:** A particular type of QEC mentioned as having high fault tolerance."",""Fault-Tolerant Quantum Computing:**  The goal of using QEC."",""Silicon CMOS Architecture:** The core proposal of the paper, using existing technology."",""Spin Qubits:** The specific type of qubit utilized in the proposed architecture."",""Silicon-on-Insulator (SOI) Wafer:** The material base for the proposed architecture."",""Scalability:** A key requirement and challenge for quantum computing, addressed by this architecture."",""Classical-Quantum Interface:**  The connection between classical control systems and the quantum processor."",""Transistor-based Control Circuit:** How the qubits are controlled."",""Charge-Storage Electrodes:** Used in conjunction with transistors for qubit operation."",""Quantum Dot:** The physical structure confining the single electron spin."",""Exchange Interactions:** How the qubits are coupled."",""Microwave Cavity:** Used for qubit control."",""Gate-based Dispersive Readout:** How the qubit states are measured."",""Two-Dimensional Qubit System:** The physical layout of the qubits."",""Parallel Addressing:** A method borrowed from classical computing, adapted for qubit control."",""Floating Memory Gate Electrodes:** Used for qubit stabilization, analogous to DRAM."",""CMOS Technology:**  Leveraging existing and mature technology for quantum computing."",""Integrated Circuits (ICs):**  Relating the architecture to existing silicon chip technology."",""This list covers the key concepts and terms that are central to understanding the paper""}","M. Veldhorst, H. G. J. Eenink, C. H. Yang, A. S. Dzurak",142,quantum_physics,Silicon CMOS architecture for a spin-based quantum computer,True
quantum_physics,2024-12-19,http://arxiv.org/abs/2412.15183v1,"{""Black hole interior"",""Quantum complexity"",""Operator rank"",""Circuit complexity"",""Circuit depth"",""Hartman-Maldacena (HM) surface"",Area,""Quantum circuit"",""Thermofield double (TFD) state"",""Entanglement entropy"",""Sachdev-Ye-Kitaev (SYK) model"",""Krylov complexity"",""Operator Schmidt rank"",""Wheeler-DeWitt patch"",""Black hole state"",""Quantum dynamics"",""Unitary evolution"",""Entanglement in time"",""Codimension-two surface"",""Extremal surface""}",Alexey Milekhin,143,quantum_physics,From black hole interior to quantum complexity through operator rank,True
quantum_physics,2024-12-19,http://arxiv.org/abs/2412.15181v1,"{Cosmology**,""Cosmological Principle**"",""FLRW Metric**"",""Metric Perturbations**"",""Stress-Energy Perturbations**"",Inflation**,""CMB Anomalies**"",""Large-Scale Structure**"",Backreaction**,""Spatial Anisotropies**"",""Hubble Flow**"",""Long-Wavelength Perturbations**"",""Scalar Perturbations**"",""Tensor Perturbations**"",""Bianchi Cosmologies**"",""Bianchi Type I**"",""Bianchi Type V**"",""Bianchi Type IX**"",""Spatial Curvature**"",""Gravitational Waves**"",""Adiabatic Perturbations**"",""Matter-Dominated Universe**"",""Gauge Modes**"",""Horizon Scale**"",""Superhorizon Fluctuations**""}","Jorge Noreña, Thiago Pereira, Sean K. Reynolds",144,quantum_physics,Spatial anisotropies from long wavelength tensor modes,True
quantum_physics,2024-12-19,http://arxiv.org/abs/2412.15180v1,"{""Page Curve"",""Black Hole Information Paradox"",""Entanglement Dynamics"",""Quantum Computing"",""Quantum Simulation"",""Hawking Radiation"",""Qubit Transport Model"",""Scrambling Dynamics"",""Random Unitary Circuit"",""Swap-based Many-Body Interference"",""Randomized Measurement Protocol"",""R´enyi Entropy"",""IBM Superconducting Quantum Computers"",""Quantum Error Mitigation"",""Quantum Entanglement"",""Hayden-Preskill Protocol"",""Yoshida-Kitaev Decoding Protocol""}","Talal Ahmed Chowdhury, Kwangmin Yu, Muhammad Asaduzzaman, Raza Sabbir Sufian",145,quantum_physics,Capturing the Page Curve and Entanglement Dynamics of Black Holes in Quantum Computers,True
quantum_physics,2007-05-02,http://dx.doi.org/10.1038/nphys698,"{""Quantum computing"",""Quantum computers"",Scalability,Qubits,""Optical tweezers"",""Neutral atoms"",""Atom transport"",""Qubit transfer"",""Coherence preservation"",""Dipole trap"",""Quantum register"",""Two-qubit gate"",""Quantum gate"",""Trapped ions"",""Holographic techniques"",""Micro-fabricated elements"",""Mott insulator transition"",""Optical lattice"",""Bose-Einstein condensate"",""Subwavelength addressability"",""Optical conveyor belts"",""State-dependent moving optical lattices"",""Rubidium 87"",""Hyperfine ground states"",""Raman transition"",""Ramsey interferometry"",""Spin echo"",Dephasing,""Single-qubit operations"",""Cold atoms"",""Atom manipulation""}","J. Beugnon, C. Tuchendler, H. Marion, A. Gaetan, Y. Miroshnychenko, Y. R. P. Sortais, A. M. Lance, M. P. A. Jones, G. Messin, A. Browaeys, P. Grangier",146,quantum_physics,Two-dimensional transport and transfer of a single atomic qubit in optical tweezers,True
quantum_physics,2024-12-19,http://arxiv.org/abs/2412.15131v1,"{""Gravitational waves (GW)"",""Extreme Mass Ratio Inspirals (EMRIs)"",LISA,""Black holes (BHs)"",""Scalar field"",""Scalar wig"",Schwarzschild,Kerr,""Orbital motion"",""Gravitational waveform"",""Mass ratio"",""Fundamental physics"",""General Relativity (GR)"",""Standard Model"",""Scalar charge"",""Binary coalescence"",""Strong-field gravity"",Perturbations,Fluxes,LIGO,Virgo,KAGRA,""Non-minimal coupling""}","Matteo Della Rocca, Georgios Antoniou, Leonardo Gualtieri, Andrea Maselli",155,quantum_physics,Probing time-dependent scalar wigs with extreme mass ratio inspirals,True
quantum_physics,2023-08-20,http://arxiv.org/abs/2308.10218v1,"{""Nuclear Magnetic Resonance (NMR)**: This is the central theme of the paper."",""Quantum Mechanics**: The theoretical framework used to describe NMR phenomena."",""Spin 1/2**: The specific type of quantum system being studied."",""Magnetic Field Gradients**:  A key experimental parameter and potential tool for quantum computing."",""Schrödinger Equation**: The fundamental equation used to analyze the spin evolution."",""Hamiltonian**: The operator representing the energy of the system."",""Nuclear Spin Noise**:  A phenomenon studied and explained within the context of the presented theory."",""Magnetic Resonance Imaging (MRI)**: An application of NMR mentioned in the context of the research."",""Radio Frequency (RF) Magnetic Fields**:  Traditional tool in NMR, contrasted with the gradient-based approach."",""Entangled Spin 1/2 States**:  Relevant to the potential application in quantum computing."",""Quantum Computation**:  A potential application of manipulating spins with magnetic field gradients."",""Magnetic Field**:  The fundamental interaction influencing the spin system."",""Wave Function**:  The quantum mechanical description of the spin state."",""Magnetization**:  A macroscopic observable related to the spin state."",""Complex Susceptibility**:  A quantity used to describe the response of the spin system."",""Pauli Matrices**:  Mathematical objects used to represent spin operators."",""Open Quantum Systems**:  A theoretical framework mentioned in relation to the spin system interacting with its environment."",""It\\""}","Tarek Khalil, Daniel Grucker",147,quantum_physics,Reformulating the NMR Quantum Mechanics Fundamental Aspects: Spin 1/2 Evolution in Magnetic Field Gradients,True
quantum_physics,2024-12-18,http://arxiv.org/abs/2412.01446v3,"{""Quantum Error Correction:**  A central theme of the paper."",""Fault-Tolerant Quantum Computation:** The ultimate goal motivating this research."",""Surface Codes:** The specific type of quantum error correction used."",""Magic State Injection:** The method used for implementing non-Clifford operations."",""Non-Clifford Gates/Operations:** Necessary for universal quantum computation."",""Clifford Gates/Operations:**  Contrasted with non-Clifford gates."",""Qubit-Efficient Rotated Heavy-Hexagonal Surface Code:** The specific code layout used, emphasizing efficiency and adaptation to IBM hardware."",""IBM Quantum Processors (ibm fez):** The hardware platform used for experiments."",""Error Thresholds:**  A key metric for fault tolerance, reported for both bit- and phase-flip errors."",""Logical Bit-Flip Errors:** A specific type of error."",""Logical Phase-Flip Errors:** A specific type of error."",""Magic State Distillation Threshold:** A benchmark for magic state fidelity."",""Logical Magic States (|HL⟩ and |TL⟩):** Specific magic states prepared."",""Fidelity:** A measure of the accuracy of the prepared magic states."",""Arbitrary Single Logical Qubit States:**  Demonstrates the generality of the approach."",""Universal Quantum Computing:** The overarching goal of this research area."",""Quantum Hardware:** The physical implementation of quantum computers."",""Connectivity Constraints:** Challenges posed by the physical layout of qubits."",""Scalability:** The ability to build larger, more powerful quantum computers."",""It\\""}","Younghun Kim, Martin Sevior, Muhammad Usman",148,quantum_physics,Magic State Injection on IBM Quantum Processors Above the Distillation Threshold,True
quantum_physics,2024-12-19,http://arxiv.org/abs/2412.15158v1,"{""Gravitational Waves (GW)"",""Dark Binaries"",""Finite-Range Dark Forces"",""Stochastic Gravitational Wave Background (SGWB)"",""Dark Matter"",""Dark Force Mediator"",""Binary Evolution"",""Orbital Evolution"",""GW Spectrum"",""Binary Merger"",""Binary Separation"",""GW Observatories (Space-based and Ground-based)"",""Pulsar Timing Arrays (PTAs)"",""Beyond the Standard Model (BSM)"",""Compact Objects"",""Supermassive Black Holes"",""Macroscopic Dark Matter""}","Yang Bai, Sida Lu, Nicholas Orlofsky",149,quantum_physics,Gravitational Waves From Dark Binaries With Finite-Range Dark Forces,True
quantum_physics,2024-12-19,http://arxiv.org/abs/2412.15148v1,"{""Gravitational lensing"",""Gravitational waves (GWs)"",""Type II lensed images"",""Phase consistency test"",""Waveform parameter"",""(2,2) mode"",""(3,3) mode"",""Phase offset (-π/12)"",""Compact binary mergers"",""Binary black hole (BBH) merger"",LIGO,Virgo,KAGRA,""Signal detection"",""SNR (Signal-to-Noise Ratio)"",GW190412,GW190814,""Bayes Factor"",""General Relativity (GR)"",""Spherical harmonics"",""Mass ratio"",""Precessing signals"",""Lens equation"",""Type I images"",""Type III images"",""Geometric optics"",Magnification}","Kelsie Taylor, Derek Davis, Rico K. L. Lo",150,quantum_physics,Phase consistency test to identify type II strongly lensed gravitational wave signals using a single event,True
quantum_physics,2024-12-19,http://arxiv.org/abs/2412.15147v1,"{""Variational Algorithms"",""Quantum Approximate Optimization Algorithm (QAOA)"",""Local Hamiltonian Problems"",""Random Regular Graphs"",""Quantum MaxCut (QMC)"",""EPR Hamiltonian"",""Antiferromagnetic Heisenberg Spin Chain"",""Combinatorial Optimization"",""Approximation Algorithms"",""Quantum PCPs"",""2-local Hamiltonian"",""Graph Optimization"",""Classical Algorithms"",Ansatz,""Infinite-Size Limit"",""Worst-Case Algorithm"",""Ground State Energy"",""Quantum Algorithms""}","Kunal Marwaha, Adrian She, James Sud",151,quantum_physics,Performance of Variational Algorithms for Local Hamiltonian Problems on Random Regular Graphs,True
quantum_physics,2024-12-19,http://dx.doi.org/10.1093/mnrasl/slae112,"{""\""* **Cosmology:** This is the overarching theme of the paper."",""Cosmological models:**  The paper compares different models."",""Supernovae (SNe Ia):** These are the primary observational data used."",""Pantheon+:**  The specific supernova dataset used."",""ΛCDM:** The standard cosmological model being challenged."",""Timescape cosmology:** The alternative model being proposed."",""Dark energy:** A key component of ΛCDM, contrasted with timescape""}","Antonia Seifert, Zachary G. Lane, Marco Galoppo, Ryan Ridden-Harper, David L. Wiltshire",152,quantum_physics,Supernovae evidence for foundational change to cosmological models,True
quantum_physics,2006-01-03,http://dx.doi.org/10.1103/PhysRevD.73.044021,"{Cosmology**,""Cosmological Perturbation Theory**"",""General Relativity**"",""Newtonian Gravity**"",""Relativistic-Newtonian Correspondence**"",""Zero-Pressure Fluid**"",""Friedmann World Model**"",""Gauge Conditions**"",""Comoving Gauge**"",""Synchronous Gauge**"",""Gauge Invariance**"",""Gauge Modes**"",""Second-Order Perturbations**"",""Gravitational Waves**"",""Hydrodynamic Equations**"",""Lagrangian Frame**"",""Eulerian Frame**"",""Density Perturbation**"",""Nonlinear Perturbations**""}","J. Hwang, H. Noh",153,quantum_physics,Second-order perturbations of a zero-pressure cosmological medium: comoving vs. synchronous gauge,True
quantum_physics,2024-12-19,http://arxiv.org/abs/2412.15134v1,"{""Quantum Error Correction"",""Cat Codes"",""Bosonic Codes"",""Fault Tolerance"",""Quantum Computing"",""Quantum Information Processing"",Teleportation,""Syndrome Extraction"",""Ancillary States"",""Rotationally Symmetric Codes"",""Qubit Codes"",""Qudit Codes"",""Harmonic Oscillator"",""Phase Space"",""Continuous-Variable Hilbert Space"",""Non-linear Interactions"",""State Preparation"",""Inter-mode Interactions"",""Quantum Enhanced Devices"",""Quantum Advantage"",""Trapped Ions"",""Superconducting Circuits"",""Photonic Subsystems"",""Modular/Distributed Quantum Computing""}","Michael Hanks, Soovin Lee, Nicolo Lo Piparo, Shin Nishio, William J. Munro, Kae Nemoto, M. S. Kim",154,quantum_physics,Faulty States can be used in Cat Code Error Correction,True
quantum_physics,2016-08-16,http://dx.doi.org/10.1093/mnras/stw2073,"{""Cosmology** (This is the overarching theme)"",""Interacting Dark Energy (IDE)** (The primary subject of investigation)"",""Dark Energy**"",""Dark Matter**"",""Hubble Constant (H0)** (A key measurement and source of tension)"",""Hubble Parameter (H(z))**"",""ΛCDM Model** (The standard cosmological model being tested)"",""Cosmic Microwave Background (CMB)** (A key observational dataset)"",""Baryon Acoustic Oscillations (BAO)** (Another key observational dataset)"",""Large Scale Structure (LSS)** (Observational data)"",""Supernovae Type Ia (SNe Ia)** (Observational data)"",""Cosmological Observations**"",""Cosmological Parameters**"",""Cosmic Acceleration**"",""H0 Tension** (The discrepancy between local and CMB-derived H0 values)"",""Late-Time Universe** (The era where the tension is relevant)"",""Distance Priors** (Type of observational data)"",""I have avoided including terms like \""Universe,\"" \""evolution,\"" \""physics,\"" and \""model\"" as they are too general for this specific context.  The keywords provided are more specific to the research presented in the abstract.""}","Dong-Mei Xia, Sai Wang",156,quantum_physics,Constraining interacting dark energy models with latest cosmological observations,True
quantum_physics,2024-12-19,http://arxiv.org/abs/2412.15117v1,"{""Kerr black hole"",""Tidal perturbation"",""Tidal Love numbers (TLNs)"",""Schwarzschild black hole"",""Rotating black hole"",""Non-extremal black hole"",""Extremal black hole"",""Static tidal response"",""Dynamic tidal response"",""Gravitational waves"",""Black hole shadow"",""Scalar perturbation"",""Electromagnetic perturbation"",""Gravitational perturbation"",""Tidal dissipation"",""Axi-symmetric perturbation"",""General relativity"",""Black hole merger""}","Rajendra Prasad Bhatt, Sumanta Chakraborty, Sukanta Bose",157,quantum_physics,Response of a Kerr black hole to a generic tidal perturbation,True
quantum_physics,2024-12-19,http://arxiv.org/abs/2412.15110v1,"{""nanofluidics:** The study of fluids confined within structures of nanometer-scale dimensions."",""superfluidity:** The property of flowing without viscosity at very low temperatures, exhibited by liquid helium."",""turbulence:** Chaotic and unpredictable fluid motion."",""quantum turbulence:** Turbulence in a superfluid, characterized by quantized vortices."",""two-dimensional turbulence:** Turbulence confined to a 2D plane, exhibiting unique properties like the inverse energy cascade."",""superfluid acoustics:** The study of sound propagation in superfluids."",""fourth sound:** A coupled pressure and entropy density wave in superfluid helium confined in narrow channels."",""quantized vortices:** Discrete vortex lines in a superfluid, carrying quantized circulation."",""Onsager vortex gas:** A model for 2D quantum turbulence where quantized vortices behave like point vortices."",""multimode acoustic resonator:** A resonator supporting multiple acoustic modes simultaneously."",""pump-probe technique:** An experimental method where a system is excited (pumped) and then its response is measured (probed)."",""dissipative coupling:** Energy transfer between different modes due to dissipative processes."",""nano-superfluidic acoustic resonator:** A nanoscale device designed to resonate at specific frequencies in superfluid helium."",""viscous clamping:** The suppression of normal fluid motion due to viscosity in confined geometries."",""high aspect ratio flows:** Flows where one dimension is much larger than the others."",""inverse cascade:** A phenomenon in 2D turbulence where energy flows from small to large scales."",""Additionally, while not keywords in the traditional sense, the following concepts are central to the text and could be considered for indexing or further analysis:"",""Gravitational wave detectors**"",""Dark matter detectors**"",""Optomechanical systems**""}","Filip Novotný, Marek Talíř, Emil Varga",158,quantum_physics,Turbulent dissipative coupling in nanoscale multimode superfluid acoustics,True
quantum_physics,2024-12-19,http://arxiv.org/abs/2412.15100v1,"{""Model Misspecification"",""Simulation-Based Inference (SBI)"",""Anomaly Detection"",""Model Validation"",""Model Comparison"",""Bayesian Parameter Estimation"",""Distortion-Driven Model Misspecification Tests"",Goodness-of-Fit,""Hypothesis Testing"",""Implicit-Likelihood Inference"",""Data-Generating Function"",Simulator,""Gravitational Wave Data"",GW150914,""Residual Analysis"",""Self-Calibrating Training Algorithm""}","Noemi Anau Montel, James Alvey, Christoph Weniger",159,quantum_physics,Tests for model misspecification in simulation-based inference: from local distortions to global model checks,True
quantum_physics,2024-05-17,http://dx.doi.org/10.1103/PhysRevD.109.104011,"{""Linear stability"",""Boson stars"",""Nonrelativistic limit"",""Einstein-Klein-Gordon theory"",""Gross-Pitaevskii-Poisson system"",""Self-interaction (repulsive, attractive)"",""Ground state"",""Excited states"",""Stability band"",""Scalar field"",Perturbations,""Numerical methods"",""Analytic methods"",""Maximum mass"",""Quartic self-interaction potential"",""Numerical simulations"",""3D numerical evolutions""}","Emmanuel Chávez Nambo, Alberto Diez-Tejedor, Armando A. Roque, Olivier Sarbach",160,quantum_physics,On the linear stability of nonrelativistic selfinteracting boson stars,True
quantum_physics,2024-12-19,http://arxiv.org/abs/2412.15088v1,"{""Ultracold Polar Molecules:** This is the central subject of the research."",""Rotational States:** The specific degrees of freedom being studied and manipulated."",""Coherent Spin-1 Dynamics:** The core phenomenon being demonstrated and investigated."",""Magic-Wavelength Optical Tweezer Traps:** The experimental technique used to mitigate decoherence."",""Multi-Transition Coherence:**  The achieved coherence between multiple rotational states, a key result."",""Second-Scale Coherence:**  Indicates the timescale of the achieved coherence, highlighting its significance."",""Multiparameter Estimation:** A specific application of the achieved coherence, using a generalized Ramsey sequence."",""Quantum Simulation:** A potential application of the research findings."",""Quantum Computation:** Another potential application, leveraging the controllable rotational states."",""Quantum Metrology:**  A further potential application, exploiting the precise control and measurement capabilities."",""Dipolar Interactions:**  The interactions between molecules, tunable and relevant for quantum simulation."",""Radiative Lifetimes:**  A property of the rotational states, important for maintaining coherence."",""Microwave Coupling:**  The method used to control and manipulate the rotational states."",""Qudits:**  Higher-dimensional quantum units of information, enabled by the multiple rotational states."",""Synthetic Dimensions:**  A concept using internal states to mimic spatial dimensions."",""Quantum Magnetism:**  Models of magnetic systems implemented using the rotational states."",""Decoherence:**  The loss of coherence, a major challenge addressed in the research."",""Differential Polarisability:**  The primary cause of decoherence in this system."",""Magic Polarization:** An earlier approach to mitigate decoherence."",""Generalized Ramsey Sequence:** The experimental technique used for multiparameter estimation.""}","Tom R. Hepworth, Daniel K. Ruttley, Fritz von Gierke, Philip D. Gregory, Alexander Guttridge, Simon L. Cornish",161,quantum_physics,Coherent spin-1 dynamics encoded in the rotational states of ultracold molecules,True
quantum_physics,2024-12-19,http://arxiv.org/abs/2412.15082v1,"{""Quantum Coherence"",Decoherence,""Dephasing Noise"",""Reservoir Engineering"",""Tripartite Systems"",""Relative Entropy of Coherence"",""Pure States"",""Mixed States"",""Structured Dephasing Environments"",""Finite Temperatures"",""Bath Configuration"",""Independent Environment"",""Shared Bath"",""Markov Environment"",""Memoryless Environment"",""Reservoir Memory"",""Non-Markovian Dynamics"",""Open Quantum System"",""Quantum Master Equation"",""Born Approximation"",""Markov Approximation"",""Multipartite Quantum States"",""Quantum Information Processing""}","Sovik Roy, Aahaman Kalaiselvan, Chandrashekar Radhakrishnan, Md Manirul Ali",162,quantum_physics,Reservoir engineering to protect quantum coherence in tripartite systems under dephasing noise,True
quantum_physics,2024-12-30,http://arxiv.org/abs/2412.21136v1,"{""Gravitational EFT:**  A core concept, referring to the effective field theory description of gravity."",""Dissipative Open Systems:**  The main subject of the paper, focusing on systems that lose energy to their surroundings."",""Dynamical Gravity:**  Gravity as a dynamic force interacting with the system, as opposed to a fixed background."",""Schwinger-Keldysh Formalism:** The underlying mathematical framework used to describe non-equilibrium systems."",""HydroEFT (EFT of dissipative hydrodynamics):**  A specific type of EFT used to model the environment and its dissipative effects."",""Microscopic Unitarity:** A fundamental principle ensuring the consistency of the theory."",""Energy-Momentum Tensor:**  A crucial quantity describing energy and momentum flow, relevant for gravity\\""}","Pak Hang Chris Lau, Kanji Nishii, Toshifumi Noumi",179,quantum_physics,Gravitational EFT for dissipative open systems,True
